{
  "planId": "rep-698-dux-9-suggestion-glow",
  "affectedPublicSurfaces": [
    "demo.app-juli.com/decisions/recommendations/[recommendationId]"
  ],
  "candidateVerificationJourney": {
    "mode": "candidate_verification",
    "stableTrafficPercent": 100,
    "candidatePublicTrafficPercent": 0,
    "restrictedRoute": "local/candidate Demo build — zero public canary traffic; PR fast CI + Review Agent validate before sync-before-merge",
    "syntheticShopRequired": false,
    "workersDisabledOnCandidate": true,
    "apiSideEffectsInScope": false,
    "journeys": [
      {
        "name": "recommendation-review-suggestion-glow",
        "entryUrl": "/decisions/recommendations/fixture-recommendation",
        "assertions": [
          "html_200",
          "prefilled_fields_carry_visible_glow_and_gợi_ý_bởi_juli_label",
          "fields_remain_editable",
          "no_silent_prefill_with_no_indication",
          "no_confidence_badge_retired_per_components_badges"
        ]
      }
    ]
  },
  "staticAssetChecks": {
    "required": true,
    "htmlRoutes": [
      "/decisions/recommendations/fixture-recommendation"
    ],
    "discoverFromHtml": true,
    "assetTypes": [
      "css",
      "js"
    ],
    "failOnMissing": true,
    "failOnNon200": true
  },
  "migrationCompatibility": {
    "schemaChangeInScope": false,
    "expandContractOnly": true,
    "stableAndCandidateCompatible": true,
    "destructiveMigrationAllowed": false,
    "notes": "Visual/copy affordance change in RecommendationReview Inputs stage; no DB or backend API contract change."
  },
  "rollbackAssertion": {
    "preCutoverFailureBehavior": "revert_pr_branch",
    "postCutoverFailureBehavior": "revert_merge_commit",
    "retainedStableRequired": true,
    "automatic": false
  },
  "requiredArtifacts": {
    "implementation": true,
    "intentReview": true,
    "review": true,
    "validation": true,
    "releaseMetadataHonest": true
  },
  "acceptanceCommands": [
    "pnpm --filter @juli/demo test -- --run",
    "pnpm --filter @juli/demo exec tsc --noEmit",
    "python agent-runtime/scripts/validate/run_validate.py --issue 698"
  ],
  "doNotInfer": [
    "Analytics deep link from review flow (DUX-4/#693)",
    "release evidence fields beyond this plan"
  ]
}
