{
  "planId": "rep-769-dpr-10-spine-rollout-returns",
  "affectedPublicSurfaces": [
    "demo.app-juli.com/decisions/recommendations/[recommendationId]"
  ],
  "candidateVerificationJourney": {
    "mode": "candidate_verification",
    "stableTrafficPercent": 100,
    "candidatePublicTrafficPercent": 0,
    "restrictedRoute": "local/candidate Demo build — zero public canary traffic; issue-tier CI + Review Agent validate before merge into feature/dpr-demo-wave",
    "syntheticShopRequired": false,
    "workersDisabledOnCandidate": true,
    "apiSideEffectsInScope": false,
    "journeys": [
      {
        "name": "returns-domain-on-the-spine",
        "entryUrl": "/decisions/recommendations/fixture-recommendation",
        "assertions": [
          "html_200",
          "seven_known_fields_collapse_to_one_summary_row",
          "resellable_quantity_absent_from_approval_flow",
          "reject_reason_only_on_reject_branch"
        ]
      }
    ]
  },
  "staticAssetChecks": {
    "required": true,
    "htmlRoutes": [
      "/decisions/recommendations/fixture-recommendation"
    ],
    "discoverFromHtml": true,
    "assetTypes": [
      "css",
      "js"
    ],
    "failOnMissing": true,
    "failOnNon200": true
  },
  "migrationCompatibility": {
    "schemaChangeInScope": false,
    "expandContractOnly": true,
    "stableAndCandidateCompatible": true,
    "destructiveMigrationAllowed": false,
    "notes": "apps/demo frontend change under ADR-055; no DB migration and no backend API contract change."
  },
  "rollbackAssertion": {
    "preCutoverFailureBehavior": "revert_pr_branch",
    "postCutoverFailureBehavior": "revert_merge_commit",
    "retainedStableRequired": true,
    "automatic": false
  },
  "requiredArtifacts": {
    "implementation": true,
    "intentReview": true,
    "review": true,
    "validation": true,
    "releaseMetadataHonest": true
  },
  "acceptanceCommands": [
    "corepack pnpm check:demo",
    "python agent-runtime/scripts/ci/generate_validation_artifact.py --issue 769"
  ],
  "doNotInfer": [
    "restock warning display — deferred by ADR-055 items 9 and 14",
    "repeat consent — these workflows are excluded (DPR-16)",
    "release evidence fields beyond this plan"
  ]
}
